"id","titre","annee_sortie","duree_minutes","realisateur","genre","resume","date_creation"
1,"Le Mystère de la Forêt Perdue",2021,120,"Jean-Luc Martin","Aventure","Un groupe d'amis découvre une forêt mystérieuse avec des créatures mythiques.","2025-07-10T12:35:10.000Z"
2,"L'Ombre du Passé",2019,110,"Sophie Leroux","Drame","Une femme retourne dans sa ville natale pour affronter les démons de son passé.","2025-07-10T12:35:10.000Z"
3,"Voyage vers l'Inconnu",2022,135,"Pierre Dubois","Science-Fiction","Un équipage spatial part à la découverte d'une nouvelle galaxie.","2025-07-10T12:35:10.000Z"
4,"Les Secrets de Montmartre",2020,95,"Claire Moreau","Thriller","Un détective résout une série de meurtres mystérieux dans le quartier de Montmartre.","2025-07-10T12:35:10.000Z"
5,"Le Rêve d'une Vie",2023,140,"Lucien Bernard","Fantaisie","Un enfant découvre un monde magique à travers ses rêves.","2025-07-10T12:35:10.000Z"